,round,agreement_status,fairness,fairness_top_words,cooperativeness,cooperativeness_top_words,manipulativeness,manipulativeness_top_words,conversation_quality,conversation_quality_top_words,ambiguity,ambiguity_top_words,summary
0,1,ongoing,6,"contributions, recognition",7,"flexible, discussion",4,"undervalues, worthless",8,"structured, rationale",3,"clear, specific",Negotiation ongoing with clear proposals from both sides. Good structure and rationale provided. Moderate fairness as both claim undervaluation. Cooperative tone with flexibility signals. Some manipulative language present. Low ambiguity with specific numbers and terms.
1,2,ongoing,6,"capital, contributions",7,"movement, consultation",5,"undervaluing, worthless",8,"structured, rationale",3,"clear, specific",Negotiation remains ongoing with both parties making incremental concessions. Proposals are well-structured with clear rationales. Moderate fairness concerns exist around valuation of IP versus capital. Some manipulative language present but overall cooperative tone. Low ambiguity with specific terms proposed throughout.
2,3,ongoing,6,"compromise, imbalance",7,"flexibility, consultation",5,"undervaluing, conflating",8,"structured, rationale",3,"clear, specific","Negotiation shows strong structure and clear proposals with detailed rationales. Both parties demonstrate flexibility through incremental concessions. Some manipulative framing exists around value contributions. Gap narrowing from 70/30 to potential 51/49 equity split shows progress, though fundamental control issues remain unresolved."
3,4,ongoing,6,"compromise, imbalance",7,"flexibility, concessions",5,"framing, undervaluing",8,"structured, detailed",3,"clear, specific","Negotiation remains ongoing with both parties making incremental concessions. Technical founder moved from 70% to 55-58%, business founder from 60% to 52-53%. Structured proposals with clear rationales demonstrate high conversation quality and low ambiguity. Moderate cooperativeness shown through flexibility, though both parties persistently frame the other's contributions as less valuable, creating mild manipulativeness and fairness concerns."
4,5,ongoing,7,"balanced, compromise",8,"flexible, creative",4,"framing, positioning",8,"structured, professional",3,"clear, specific","Both parties demonstrate strong cooperativeness through multiple counterproposals and creative structuring. The negotiation shows professional quality with clear positions. Minor manipulative framing exists around value contributions. Low ambiguity with specific terms. Fair progress toward 53/47 equity split, though budget allocation and CEO authority remain unresolved."
5,6,failed,4,"imbalance, ultimatum",5,"concessions, rigidity",7,"ultimatum, pressure",6,"structured, adversarial",3,"clear, explicit","Negotiation failed after 12 exchanges. Business Founder issued non-negotiable ultimatum demanding 51/49 equity split and CEO authority, reversing previous 53/47 acceptance. Technical Founder's final position of 53/47 with domain-specific authority was rejected. High manipulativeness due to ultimatum tactics and threat of mediation."
